thesis_project/experiment_analysis/fastest_learning_speed/fastest_learning_by_env_algo.csv

env,algo,best_T_to_target,run_dir,seed,total_timesteps,n_envs,learning_rate,n_steps,gamma,gae_lambda,ent_coef,vf_coef,max_grad_norm,use_rms_prop,rms_prop_eps,policy_kwargs,batch_size,n_epochs,clip_range,target_kl,use_sde,sde_sample_freq,clip_range_vf
CartPole-v1,a2c,20000,/homes/sohawan2/reinforcement-learning-thesis/thesis_project/runs/CartPole-v1/a2c/20251026_204450_479346_pid1011363_seed0,0,300000,,0.0003,64,0.995,0.95,0.0,0.5,0.5,True,0.0001,"{""net_arch"": [128, 128]}",,,,,,,
CartPole-v1,ppo,20000,/homes/sohawan2/reinforcement-learning-thesis/thesis_project/runs/CartPole-v1/ppo/20251027_043006_663272_pid1092220_seed0,0,200000,,0.0001,128,0.995,0.9,0.02,0.5,0.5,,,"{""net_arch"": [128, 128]}",32.0,20.0,0.3,0.02,,,
Hopper-v4,a2c,1160000,/homes/sohawan2/reinforcement-learning-thesis/thesis_project/runs/Hopper-v4/a2c/20251107_171248_728087_pid2961473_seed0,0,3000000,,0.0007,128,0.99,0.9,0.0,0.5,0.5,True,1e-05,"{""net_arch"": [256, 256], ""ortho_init"": true}",,,,,True,4.0,
Hopper-v4,ppo,100000,/homes/sohawan2/reinforcement-learning-thesis/thesis_project/runs/Hopper-v4/ppo/20251114_120354_489411_pid467260_seed0,0,2000000,,0.0003,2048,0.995,0.97,0.005,0.5,0.5,,,"{""net_arch"": [256, 256], ""ortho_init"": true, ""log_std_init"": -1.0}",256.0,20.0,0.2,0.02,True,4.0,
LunarLander-v3,a2c,80000,/homes/sohawan2/reinforcement-learning-thesis/thesis_project/runs/LunarLander-v3/a2c/20251027_065945_076170_pid1113310_seed0,0,1500000,,0.0007,64,0.99,0.9,0.01,0.5,0.5,True,1e-05,"{""net_arch"": [256, 256], ""ortho_init"": true}",,,,,,,
LunarLander-v3,ppo,60000,/homes/sohawan2/reinforcement-learning-thesis/thesis_project/runs/LunarLander-v3/ppo/20251029_025301_255403_pid152720_seed0,0,1000000,,0.0003,1024,0.99,0.9,0.02,0.5,0.5,,,"{""net_arch"": [128, 128]}",64.0,10.0,0.2,0.02,,,
LunarLanderContinuous-v3,a2c,20000,/homes/sohawan2/reinforcement-learning-thesis/thesis_project/runs/LunarLanderContinuous-v3/a2c/20251103_145513_382820_pid1849343_seed0,0,2000000,,0.0007,128,0.99,0.9,0.01,0.5,0.5,True,0.0001,"{""net_arch"": [256, 256], ""ortho_init"": true}",,,,,True,4.0,
LunarLanderContinuous-v3,ppo,20000,/homes/sohawan2/reinforcement-learning-thesis/thesis_project/runs/LunarLanderContinuous-v3/ppo/20251030_022508_204986_pid463055_seed0,0,1500000,,0.0003,1024,0.99,0.97,0.005,0.5,0.5,,,"{""net_arch"": [128, 128], ""ortho_init"": true, ""log_std_init"": -0.5}",64.0,10.0,0.2,0.01,True,4.0,

thesis_project/experiment_analysis/analyze_max_eval_reward.md

Configuration #1:
  Experiment ID: 20251105_135646_964640_pid2403106_seed0
  Reward stability: ±19.16
  Hyperparameter configuration:
    learning_rate: 0.0003
    n_steps: 256
    gamma: 0.99
    gae_lambda: 0.97
    ent_coef: 0.0
    vf_coef: 0.5
    max_grad_norm: 0.5
    use_rms_prop: True
    rms_prop_eps: 0.0001
    use_sde: True
    sde_sample_freq: 64.0
    policy_kwargs: {'net_arch': [256, 256], 'ortho_init': True}

Configuration #1:
  Experiment ID: 20251101_092021_512567_pid1116286_seed0
  Reward stability: ±16.00
  Hyperparameter configuration:
    learning_rate: 0.0001
    n_steps: 1024
    gamma: 0.995
    gae_lambda: 0.97
    ent_coef: 0.01
    vf_coef: 0.5
    max_grad_norm: 0.5
    use_sde: True
    sde_sample_freq: 64.0
    policy_kwargs: {'net_arch': [128, 128], 'ortho_init': True, 'log_std_init': -0.5}
    batch_size: 64.0
    n_epochs: 10.0
    clip_range: 0.2
    target_kl: 0.02

Configuration #1:
  Experiment ID: 20251026_195745_033169_pid1003504_seed0
  Reward stability: ±0.00
  Hyperparameter configuration:
    learning_rate: 0.0007
    n_steps: 128
    gamma: 0.995
    gae_lambda: 0.95
    ent_coef: 0.001
    vf_coef: 0.5
    max_grad_norm: 0.5
    use_rms_prop: True
    rms_prop_eps: 0.0001
    policy_kwargs: {'net_arch': [64, 64]}

Configuration #1:
  Experiment ID: 20251027_043006_663272_pid1092220_seed0
  Reward stability: ±0.00
  Hyperparameter configuration:
    learning_rate: 0.0001
    n_steps: 128
    gamma: 0.995
    gae_lambda: 0.9
    ent_coef: 0.02
    vf_coef: 0.5
    max_grad_norm: 0.5
    policy_kwargs: {'net_arch': [128, 128]}
    batch_size: 32.0
    n_epochs: 20.0
    clip_range: 0.3
    target_kl: 0.02

Configuration #2:
  Experiment ID: 20251026_232743_169136_pid1041029_seed0
  Reward stability: ±0.00
  Hyperparameter configuration:
    learning_rate: 0.0003
    n_steps: 128
    gamma: 0.99
    gae_lambda: 0.95
    ent_coef: 0.0
    vf_coef: 0.5
    max_grad_norm: 0.5
    policy_kwargs: {'net_arch': [64, 64]}
    batch_size: 32.0
    n_epochs: 10.0
    clip_range: 0.3
    target_kl: 0.02

Configuration #3:
  Experiment ID: 20251027_033419_470921_pid1083976_seed0
  Reward stability: ±0.00
  Hyperparameter configuration:
    learning_rate: 0.001
    n_steps: 512
    gamma: 0.995
    gae_lambda: 0.95
    ent_coef: 0.0
    vf_coef: 0.5
    max_grad_norm: 0.5
    policy_kwargs: {'net_arch': [64, 64]}
    batch_size: 32.0
    n_epochs: 10.0
    clip_range: 0.2
    target_kl: 0.02

Configuration #1:
  Experiment ID: 20251027_151212_950323_pid1268875_seed0
  Reward stability: ±17.49
  Hyperparameter configuration:
    learning_rate: 0.0007
    n_steps: 256
    gamma: 0.995
    gae_lambda: 0.97
    ent_coef: 0.01
    vf_coef: 0.5
    max_grad_norm: 0.5
    use_rms_prop: True
    rms_prop_eps: 0.0001
    policy_kwargs: {'net_arch': [256, 256], 'ortho_init': True}

Configuration #1:
  Experiment ID: 20251029_023406_629011_pid149793_seed0
  Reward stability: ±18.75
  Hyperparameter configuration:
    learning_rate: 0.0003
    n_steps: 1024
    gamma: 0.99
    gae_lambda: 0.97
    ent_coef: 0.01
    vf_coef: 0.5
    max_grad_norm: 0.5
    policy_kwargs: {'net_arch': [256, 256], 'ortho_init': True}
    batch_size: 64.0
    n_epochs: 10.0
    clip_range: 0.1
    target_kl: 0.01

Environment: LunarLanderContinuous-v3 | Algorithm: ppo
Number of experiments: 3840
Recommended experiment ID: 20251101_092021_512567_pid1116286_seed0
Recommended configuration (reward: 297.00 ± 16.00):
  learning_rate: 0.0001
  n_steps: 1024
  gamma: 0.995
  gae_lambda: 0.97
  ent_coef: 0.01
  vf_coef: 0.5
  max_grad_norm: 0.5
  use_sde: True
  sde_sample_freq: 64.0
  policy_kwargs: {'net_arch': [128, 128], 'ortho_init': True, 'log_std_init': -0.5}
  batch_size: 64.0
  n_epochs: 10.0
  clip_range: 0.2
  target_kl: 0.02

Environment: CartPole-v1 | Algorithm: a2c
Number of experiments: 786
Recommended experiment ID: 20251026_195745_033169_pid1003504_seed0
Recommended configuration (reward: 500.00 ± 0.00):
  learning_rate: 0.0007
  n_steps: 128
  gamma: 0.995
  gae_lambda: 0.95
  ent_coef: 0.001
  vf_coef: 0.5
  max_grad_norm: 0.5
  use_rms_prop: True
  rms_prop_eps: 0.0001
  policy_kwargs: {'net_arch': [64, 64]}

Environment: CartPole-v1 | Algorithm: ppo
Number of experiments: 1585
Recommended experiment ID: 20251027_043006_663272_pid1092220_seed0
Recommended configuration (reward: 500.00 ± 0.00):
  learning_rate: 0.0001
  n_steps: 128
  gamma: 0.995
  gae_lambda: 0.9
  ent_coef: 0.02
  vf_coef: 0.5
  max_grad_norm: 0.5
  policy_kwargs: {'net_arch': [128, 128]}
  batch_size: 32.0
  n_epochs: 20.0
  clip_range: 0.3
  target_kl: 0.02

Environment: LunarLander-v3 | Algorithm: ppo
Number of experiments: 1296
Recommended experiment ID: 20251029_023406_629011_pid149793_seed0
Recommended configuration (reward: 291.98 ± 18.75):
  learning_rate: 0.0003
  n_steps: 1024
  gamma: 0.99
  gae_lambda: 0.97
  ent_coef: 0.01
  vf_coef: 0.5
  max_grad_norm: 0.5
  policy_kwargs: {'net_arch': [256, 256], 'ortho_init': True}
  batch_size: 64.0
  n_epochs: 10.0
  clip_range: 0.1
  target_kl: 0.01